{
  "schema_version": 1,
  "repository": "https://github.com/tsuji-tomonori/lazunex",
  "revision": "096e1e580ab1c0670c57e4febad2bd9fdd4698ee",
  "source_root": "src/tools",
  "scope": "reference-blueprint",
  "file_count": 52,
  "tree_sha256": "8cac4a032500cf2e846f5dbbec08aa275cc9593d74a7168e8604f75fcebdfa5e",
  "requirement_ids": [
    "REQ-ASBUILT-001",
    "REQ-ASBUILT-002",
    "REQ-ASBUILT-003",
    "REQ-ASBUILT-004",
    "REQ-ASBUILT-005",
    "REQ-ASBUILT-006",
    "REQ-ASBUILT-007",
    "REQ-ASBUILT-008",
    "REQ-ASBUILT-009",
    "REQ-ASBUILT-010",
    "REQ-ASBUILT-011",
    "REQ-ASBUILT-012",
    "REQ-ASBUILT-013",
    "REQ-ASBUILT-014",
    "REQ-ASBUILT-015",
    "REQ-ASBUILT-016",
    "REQ-ASBUILT-017",
    "REQ-ASBUILT-018",
    "REQ-ASBUILT-019",
    "REQ-ASBUILT-020",
    "REQ-ASBUILT-021",
    "REQ-ASBUILT-022",
    "REQ-ASBUILT-023",
    "REQ-ASBUILT-024",
    "REQ-ASBUILT-025",
    "REQ-ASBUILT-026",
    "REQ-ASBUILT-027",
    "REQ-ASBUILT-028",
    "REQ-ASBUILT-029",
    "REQ-ASBUILT-030",
    "REQ-ASBUILT-031",
    "REQ-ASBUILT-032",
    "REQ-ASBUILT-033",
    "REQ-ASBUILT-034",
    "REQ-ASBUILT-035",
    "REQ-DESIGN-001",
    "REQ-DESIGN-002",
    "REQ-DESIGN-003",
    "REQ-DESIGN-004",
    "REQ-DESIGN-005",
    "REQ-DESIGN-006",
    "REQ-DESIGN-007",
    "REQ-DESIGN-008",
    "REQ-DESIGN-009",
    "REQ-DESIGN-010",
    "REQ-DESIGN-011",
    "REQ-DESIGN-012",
    "REQ-DESIGN-013",
    "REQ-DESIGN-014",
    "REQ-DESIGN-015",
    "REQ-DESIGN-016",
    "REQ-DESIGN-017",
    "REQ-DESIGN-018",
    "REQ-DESIGN-019",
    "REQ-DESIGN-020",
    "REQ-DESIGN-021",
    "REQ-DESIGN-022",
    "REQ-DESIGN-023",
    "REQ-DESIGN-024",
    "REQ-DESIGN-025",
    "REQ-DOCS-001",
    "REQ-DOCS-002",
    "REQ-EVIDENCE-001",
    "REQ-EVIDENCE-002",
    "REQ-EVIDENCE-003",
    "REQ-EVIDENCE-004"
  ],
  "files": [
    {
      "path": "src/tools/__init__.py",
      "blob_sha": "baa82b690b569cc06871fecc9a7322c1387cb601",
      "purpose": "tool packageの識別",
      "classification": "package-support",
      "requirement_ids": [
        "REQ-ASBUILT-030"
      ],
      "adoption": "not-adopted",
      "reason": "Python package markerは導入先言語のmodule方式に依存し、検査能力を持たない。",
      "language_assumptions": [
        "Python runtime"
      ],
      "connections": []
    },
    {
      "path": "src/tools/check_api_contracts.py",
      "blob_sha": "e6404011ff796f20701b2205ebd3880fb80cd961",
      "purpose": "操作metadataと登録operationの対応検査",
      "classification": "static-checker",
      "requirement_ids": [
        "REQ-ASBUILT-012",
        "REQ-DESIGN-009"
      ],
      "adoption": "adapt",
      "reason": "metadataの実登録照合を基に、導入先の公開契約と責務の実呼出しを検査する。",
      "language_assumptions": [
        "Python AST"
      ],
      "connections": [
        ".agents/skills/generate-implementation-design/references/adapter-contract.md"
      ]
    },
    {
      "path": "src/tools/check_api_descriptions.py",
      "blob_sha": "54f3e3c888862da3b2fb0f89ef7698f7f3684377",
      "purpose": "API/schema/enumの日本語説明検査",
      "classification": "static-checker",
      "requirement_ids": [
        "REQ-DOCS-002"
      ],
      "adoption": "adapt",
      "reason": "Field/decorator依存を導入先の型・公開metadataへ置換し、指定された説明言語を検査する。",
      "language_assumptions": [
        "Python AST"
      ],
      "connections": [
        ".agents/skills/generate-implementation-design/references/adapter-contract.md"
      ]
    },
    {
      "path": "src/tools/check_api_exception_summaries.py",
      "blob_sha": "7dad75b7d658b26a37da4c5bb7c024782e8e79ac",
      "purpose": "個別処理・外部依存の例外summary検査",
      "classification": "static-checker",
      "requirement_ids": [
        "REQ-ASBUILT-027"
      ],
      "adoption": "extend",
      "reason": "例外summary検査を基に、捕捉/再送出から応答・運用対応までの未解決経路も検出する。",
      "language_assumptions": [
        "Python AST"
      ],
      "connections": [
        ".agents/skills/generate-implementation-design/references/adapter-contract.md"
      ]
    },
    {
      "path": "src/tools/check_api_function_exception_policy.py",
      "blob_sha": "939adc54d590b47ec8c2ed4b622021d7bc89ea6d",
      "purpose": "個別業務処理のHTTP例外禁止と資源未設定時の例外方針検査",
      "classification": "static-checker",
      "requirement_ids": [
        "REQ-DESIGN-021"
      ],
      "adoption": "adapt",
      "reason": "HTTPExceptionの直接送出禁止を通信層固有例外の境界へ適応する。固有資源名・例外型を固定せず、別名・同期/非同期の正負例を追加する。",
      "language_assumptions": [
        "Python AST"
      ],
      "connections": [
        ".agents/skills/generate-implementation-design/references/adapter-contract.md"
      ]
    },
    {
      "path": "src/tools/check_api_function_names.py",
      "blob_sha": "67081d8a0728e8d703199810b6594b297b310ce3",
      "purpose": "処理名の動詞・対象・条件辞書との照合",
      "classification": "static-checker",
      "requirement_ids": [
        "REQ-DOCS-002"
      ],
      "adoption": "not-adopted",
      "reason": "lazunex固有の命名辞書は移植しない。責務と自然言語説明の検査で可読性を確保する。",
      "language_assumptions": [
        "Python AST"
      ],
      "connections": []
    },
    {
      "path": "src/tools/check_api_function_resource_usage.py",
      "blob_sha": "8c5f4e7971450d57d8dabc8ee10ccbcb04b21d8c",
      "purpose": "個別処理のDB/外部port利用と資源引数検査",
      "classification": "static-checker",
      "requirement_ids": [
        "REQ-DESIGN-011"
      ],
      "adoption": "adapt",
      "reason": "resource-free例外とport識別を導入先へ適応し、実I/O利用を検証する。",
      "language_assumptions": [
        "Python AST"
      ],
      "connections": [
        ".agents/skills/generate-implementation-design/references/adapter-contract.md"
      ]
    },
    {
      "path": "src/tools/check_api_function_tests.py",
      "blob_sha": "191508856e6b01f417fdfe63509e833f6b49206f",
      "purpose": "個別処理と実test参照の対応検査",
      "classification": "static-checker",
      "requirement_ids": [
        "REQ-ASBUILT-020"
      ],
      "adoption": "extend",
      "reason": "名前参照だけで充足とせず、実collector IDと要件・処理の明示traceを照合する。",
      "language_assumptions": [
        "Python AST"
      ],
      "connections": [
        ".agents/skills/generate-implementation-design/references/adapter-contract.md"
      ]
    },
    {
      "path": "src/tools/check_api_managed_literals.py",
      "blob_sha": "1a1e106bcb0a708bfd3427168d9a8bec8cf7f3b4",
      "purpose": "業務literalの定数・enum利用検査",
      "classification": "static-checker",
      "requirement_ids": [
        "REQ-ASBUILT-030"
      ],
      "adoption": "not-adopted",
      "reason": "lazunex業務定数は対象固有であり移植しない。endpoint許可symbol制約は別途全source走査で実装する。",
      "language_assumptions": [
        "Python AST"
      ],
      "connections": []
    },
    {
      "path": "src/tools/check_api_mermaid_sequences.py",
      "blob_sha": "22e24c73be054e25ce93c4e99c2d98a18bc02908",
      "purpose": "Mermaidのparticipantとラベル形式検査",
      "classification": "static-checker",
      "requirement_ids": [
        "REQ-ASBUILT-026"
      ],
      "adoption": "adapt",
      "reason": "Mermaid表現検査を再利用し、実call graphとの対応は導入先解析器が補う。",
      "language_assumptions": [
        "Python runtime"
      ],
      "connections": [
        ".agents/skills/generate-implementation-design/references/adapter-contract.md"
      ]
    },
    {
      "path": "src/tools/check_api_router_ignored_returns.py",
      "blob_sha": "1614ef6366a846aff222223afdfecbe222c3ac8c",
      "purpose": "意味ある処理戻り値の破棄と副作用検査",
      "classification": "static-checker",
      "requirement_ids": [
        "REQ-DESIGN-018"
      ],
      "adoption": "extend",
      "reason": "await式中心の検査を同期/非同期・別名呼出しの負例へ拡張する。",
      "language_assumptions": [
        "Python AST"
      ],
      "connections": [
        ".agents/skills/generate-implementation-design/references/adapter-contract.md"
      ]
    },
    {
      "path": "src/tools/check_api_router_logging_tests.py",
      "blob_sha": "ad01c72af11b1c3947271dec2f0915a664c6aab5",
      "purpose": "API異常ログの実HTTP sample assertion検査",
      "classification": "static-checker",
      "requirement_ids": [
        "REQ-ASBUILT-013",
        "REQ-ASBUILT-027"
      ],
      "adoption": "adapt",
      "reason": "logger wrapper/test helper固有の名前を実呼出しとassertionの対応へ適応する。",
      "language_assumptions": [
        "Python AST"
      ],
      "connections": [
        ".agents/skills/generate-implementation-design/references/adapter-contract.md"
      ]
    },
    {
      "path": "src/tools/check_api_router_test_asserts.py",
      "blob_sha": "e3199682adefde060eddf2eb9e97eb096cfa9f29",
      "purpose": "sample応答とCRUD対象DB状態のassert検査",
      "classification": "static-checker",
      "requirement_ids": [
        "REQ-ASBUILT-013",
        "REQ-ASBUILT-014"
      ],
      "adoption": "extend",
      "reason": "source文字列照合から導入先の実テスト検証へ強化し、非SQL副作用も含める。",
      "language_assumptions": [
        "Python runtime"
      ],
      "connections": [
        ".agents/skills/generate-implementation-design/references/adapter-contract.md"
      ]
    },
    {
      "path": "src/tools/check_api_router_tests.py",
      "blob_sha": "89e4f0cfda8cc9e098640959bd635b34fbbf39a7",
      "purpose": "各operationの対応router test存在検査",
      "classification": "static-checker",
      "requirement_ids": [
        "REQ-ASBUILT-020"
      ],
      "adoption": "extend",
      "reason": "ファイル名一致だけでなく実collectorの検証単位を照合する。",
      "language_assumptions": [
        "Python runtime"
      ],
      "connections": [
        ".agents/skills/generate-implementation-design/references/adapter-contract.md"
      ]
    },
    {
      "path": "src/tools/check_api_router_unit_test_factors.py",
      "blob_sha": "fc5ed4c2abdc0cf9b319e88eaf089a779977f830",
      "purpose": "要因ケースとHTTP/status/log assertion検査",
      "classification": "static-checker",
      "requirement_ids": [
        "REQ-ASBUILT-022",
        "REQ-ASBUILT-028"
      ],
      "adoption": "adapt",
      "reason": "pytest固有nodeとassert構造を導入先のcollectorと自然言語GWTへ対応させる。",
      "language_assumptions": [
        "Python AST"
      ],
      "connections": [